{
  "$schema": "http://json-schema.org/draft-07/schema#",
  "title": "AgentMemoryConfig",
  "type": "object",
  "description": "Per-agent configuration for the Assistant Memory plugin. Stored as config.json in the agent's data directory.",
  "properties": {
    "version": {
      "type": "integer",
      "description": "Config schema version. Currently 1.",
      "minimum": 1,
      "default": 1
    },
    "lmStudioUrl": {
      "type": "string",
      "format": "uri",
      "description": "LM Studio embeddings API endpoint URL.",
      "default": "http://192.168.64.1:1234/v1/embeddings"
    },
    "lmStudioModel": {
      "type": "string",
      "description": "Model identifier in LM Studio.",
      "default": "text-embedding-qwen3-embedding-4b"
    },
    "backupInterval": {
      "type": "integer",
      "description": "Automatic backup interval in minutes.",
      "minimum": 1,
      "maximum": 60,
      "default": 5
    },
    "indexStrategy": {
      "type": "string",
      "enum": ["on-change", "on-change-plus-periodic"],
      "description": "When to update the embedding index.",
      "default": "on-change-plus-periodic"
    },
    "periodicInterval": {
      "type": "integer",
      "description": "Periodic sync interval in minutes (used with on-change-plus-periodic).",
      "minimum": 5,
      "maximum": 1440,
      "default": 30
    },
    "autoRecall": {
      "type": "boolean",
      "description": "Inject relevant memories before agent starts.",
      "default": false
    },
    "autoCapture": {
      "type": "boolean",
      "description": "Auto-capture important information after agent ends.",
      "default": false
    },
    "captureMaxChars": {
      "type": "integer",
      "description": "Max characters to capture per message (auto-capture).",
      "minimum": 100,
      "maximum": 10000,
      "default": 2000
    },
    "backupDir": {
      "type": "string",
      "description": "Directory for backups relative to agent data dir.",
      "default": ".memory/backups"
    },
    "dataDir": {
      "type": "string",
      "description": "Base directory for memory storage relative to agent data dir.",
      "default": ".memory"
    }
  },
  "additionalProperties": false
}
