{
  "version": 1,
  "lmStudioUrl": "http://192.168.64.1:1234/v1/embeddings",
  "lmStudioModel": "text-embedding-qwen3-embedding-4b",
  "backupInterval": 5,
  "indexStrategy": "on-change-plus-periodic",
  "periodicInterval": 30,
  "autoRecall": false,
  "autoCapture": false,
  "captureMaxChars": 2000,
  "backupDir": ".memory/backups",
  "dataDir": ".memory"
}
